### ISSUE TITLE
RTMP handshaking error

### ISSUE THREAD

**Issue by chakhsu** [arut/nginx-rtmp-module#1288]
debug log:

The following log shows that the handshake failed and always try again.

```
2018/07/02 17:51:21 [debug] 8714#0: *1 AMF write (21) 43 6F 6E 6E 65 63 74 69 6F 6E 20 73 75 63 63 65 'Connection succe'
2018/07/02 17:51:21 [debug] 8714#0: *1 AMF write (2) 00 0E '??'
2018/07/02 17:51:21 [debug] 8714#0: *1 AMF write (14) 6F 62 6A 65 63 74 45 6E 63 6F 64 69 6E 67 'objectEncoding'
2018/07/02 17:51:21 [debug] 8714#0: *1 AMF write (1) 00 '?'
2018/07/02 17:51:21 [debug] 8714#0: *1 AMF write (8) 00 00 00 00 00 00 00 00 '????????'
2018/07/02 17:51:21 [debug] 8714#0: *1 AMF write (2) 00 00 '??'
2018/07/02 17:51:21 [debug] 8714#0: *1 AMF write (1) 09 '?'
2018/07/02 17:51:21 [debug] 8714#0: *1 RTMP prep amf_cmd (20) fmt=0 csid=3 timestamp=0 mlen=190 msid=0 nbufs=1
2018/07/02 17:51:21 [debug] 8714#0: *1 RTMP send nmsg=1, priority=0 #4
2018/07/02 17:51:21 [debug] 8714#0: *1 send: fd:3 202 of 202
2018/07/02 17:51:21 [debug] 8714#0: *1 recv: eof:0, avail:0
2018/07/02 17:51:21 [debug] 8714#0: timer delta: 35
2018/07/02 17:51:21 [debug] 8714#0: worker cycle
2018/07/02 17:51:21 [debug] 8714#0: epoll timer: 179965
2018/07/02 17:53:06 [debug] 7943#0: timer delta: 124693
2018/07/02 17:53:06 [debug] 7943#0: *1 event timer del: 3: 1530525186649
2018/07/02 17:53:06 [debug] 7943#0: *1 ping: schedule 60000ms
2018/07/02 17:53:06 [debug] 7943#0: *1 create: ping_request timestamp=1516829273
2018/07/02 17:53:06 [debug] 7943#0: *1 RTMP prep user (4) fmt=0 csid=2 timestamp=0 mlen=6 msid=0 nbufs=1
2018/07/02 17:53:06 [debug] 7943#0: *1 RTMP send nmsg=1, priority=0 #5
2018/07/02 17:53:06 [debug] 7943#0: *1 send: fd:3 18 of 18
2018/07/02 17:53:06 [debug] 7943#0: *1 event timer add: 3: 60000:1530525246649
2018/07/02 17:53:06 [debug] 7943#0: worker cycle
2018/07/02 17:53:06 [debug] 7943#0: epoll timer: 60000
```

**Comment by chakhsu** [comment]
nginx 1.12.0

**Comment by chakhsu** [comment]
```
10      172.16.144.101  51426   183.60.177.247  1935    RTMP    Handshake C0+C1
11      183.60.177.247  1935    172.16.144.101  51426   TCP     1935 > 51426 [ACK] Seq=1 Ack=1538 Win=30976 Len=0 TSval=2516587471 TSecr=716584962
12      183.60.177.247  1935    172.16.144.101  51426   TCP     1935 > 51426 [ACK] Seq=1 Ack=1538 Win=30976 Len=1368 TSval=2516587471 TSecr=716584962
13      172.16.144.101  51426   183.60.177.247  1935    TCP     51426 > 1935 [ACK] Seq=1538 Ack=1369 Win=32128 Len=0 TSval=716584997 TSecr=2516587471
14      183.60.177.247  1935    172.16.144.101  51426   TCP     1935 > 51426 [PSH, ACK] Seq=1369 Ack=1538 Win=30976 Len=169 TSval=2516587471 TSecr=716584962
15      172.16.144.101  51426   183.60.177.247  1935    TCP     51426 > 1935 [ACK] Seq=1538 Ack=1538 Win=34944 Len=0 TSval=716584997 TSecr=2516587471
16      183.60.177.247  1935    172.16.144.101  51426   TCP     1935 > 51426 [ACK] Seq=1538 Ack=1538 Win=30976 Len=1368 TSval=2516587472 TSecr=716584962
17      172.16.144.101  51426   183.60.177.247  1935    TCP     51426 > 1935 [ACK] Seq=1538 Ack=2906 Win=37760 Len=0 TSval=716584998 TSecr=2516587472
18      183.60.177.247  1935    172.16.144.101  51426   RTMP    Handshake S0+S1+S2
19      172.16.144.101  51426   183.60.177.247  1935    TCP     51426 > 1935 [ACK] Seq=1538 Ack=3074 Win=40576 Len=0 TSval=716585032 TSecr=2516587506
20      172.16.144.101  51426   183.60.177.247  1935    RTMP    Handshake C2
21      183.60.177.247  1935    172.16.144.101  51426   TCP     1935 > 51426 [ACK] Seq=3074 Ack=3074 Win=34048 Len=0 TSval=2516587542 TSecr=716585032
22      172.16.144.101  51426   183.60.177.247  1935    RTMP    connect('gongsi')
23      183.60.177.247  1935    172.16.144.101  51426   RTMP    Window Acknowledgement Size 5000000
24      172.16.144.101  51426   183.60.177.247  1935    TCP     51426 > 1935 [ACK] Seq=3235 Ack=3090 Win=40576 Len=0 TSval=716585142 TSecr=2516587576
25      183.60.177.247  1935    172.16.144.101  51426   RTMP    Set Peer Bandwidth 5000000,Dynamic | Set Chunk Size 4000 | _result('NetConnection.Connect.Success')
26      172.16.144.101  51426   183.60.177.247  1935    TCP     51426 > 1935 [ACK] Seq=3235 Ack=3325 Win=43264 Len=0 TSval=716585176 TSecr=2516587651
27      172.16.144.101  51426   183.60.177.247  1935    TCP     51426 > 1935 [PSH, ACK] Seq=3235 Ack=3325 Win=43264 Len=12 TSval=716585177 TSecr=2516587651
28      172.16.144.101  51426   183.60.177.247  1935    RTMP    Set Chunk Size 4000 | releaseStream('fffd') | FCPublish('fffd') | createStream()
29      172.16.144.101  51426   183.60.177.247  1935    RTMP    [TCP Retransmission] Set Chunk Size 4000 | releaseStream('fffd') | FCPublish('fffd') | createStream()
30      172.16.144.101  51426   183.60.177.247  1935    RTMP    [TCP Retransmission] Set Chunk Size 4000 | releaseStream('fffd') | FCPublish('fffd') | createStream()
31      172.16.144.101  51426   183.60.177.247  1935    RTMP    [TCP Retransmission] Set Chunk Size 4000 | releaseStream('fffd') | FCPublish('fffd') | createStream()
32      172.16.144.101  51426   183.60.177.247  1935    RTMP    [TCP Retransmission] Set Chunk Size 4000 | releaseStream('fffd') | FCPublish('fffd') | createStream()
33      172.16.144.101  51426   183.60.177.247  1935    RTMP    [TCP Retransmission] Set Chunk Size 4000 | releaseStream('fffd') | FCPublish('fffd') | createStream()
34      172.16.144.101  51418   183.60.177.247  1935    RTMP    [TCP Retransmission] Set Chunk Size 4000 | releaseStream('fffd') | FCPublish('fffd') | createStream()
```
